<?xml version="1.0" encoding="UTF-8" ?>
<!-- vim: tw=0
-->
<!DOCTYPE xaraya_module SYSTEM "./modwizard.dtd">

<xaraya_module>

    <!-- ABOUT

        Information about you and your module

    -->
    <about>

        <name>ModWizard Example - Transform</name>
        <copyright>by Michael Jansen</copyright>
        <license>GPL (http://www.gnu.org/licenses/gpl.html)</license>

        <author>
            <name>Michael Jansen</name>
            <email>module-wizard@michael-jansen.biz</email>
        </author>


        <description>

            <!-- add a short ONE LINE description -->
            <short>Module Wizard Test Module III</short>
            <!-- add a description as long and detailed as you want. -->
            <long>
            * A transform module
            *   # no tables
            *   # no blocks
            *   # doesn't use hooks
            *   # provide transform hook
            * </long>
        </description>

    </about>

    <!-- MODULE REGISTRY

        insert the appropriate values you got from the module registry at
        http://www.xaraya.org

    -->
    <registry>

        <id>5648883</id>
        <name>modwizard_transform</name>

    </registry>

    <!-- MODULE CONFIGURATION related stuff -->
    <configuration>

        <!-- CAPABILITIES OF THE MODULE

        -->
        <capabilities>

            <!-- Add code for short url-support? -->
            <supportshorturls>yes</supportshorturls>

            <!-- Add code to change <head> -> <title> tag for each page? -->
            <setpagetitle>yes</setpagetitle>

            <!-- Code for hooks ?

                 module hooks are generated if either transform_hooks or item_hooks are generated
            -->
            <item_hooks>no</item_hooks>
            <transform_hooks>yes</transform_hooks>

        </capabilities>


        <!-- MODULE VARIABLES

            * create and initialize / remove in xarinit
            * create a default admin_configuration possibility ??

        -->
        <modvars>
            <!--
            <var type="number" name="MembersPerPage">0</var>
            -->
        </modvars>

        <!-- HOOKS

            You have different options here:

                The enable attribute controls the generation of the hook
                calls. These calls are only generated if you say enable="yes" !

                Inside you can list module which should be hooked during
                module initialization.

        -->
        <hooks />

        <!-- SECURITY related stuff ( ROLES / PRIVILEGES ) -->
        <security />

    </configuration>

    <!-- DATABASE related stuff -->
    <database />

    <!-- BLOCKS -->
    <blocks />

</xaraya_module>
